{
  "$schema": "https://json-schema.org/draft/2020-12/schema",
  "$id": "https://portable.dev/fixtures/acceptance/verification-artifact.json",
  "title": "Acceptance verification artifact",
  "type": "object",
  "required": ["schemaVersion", "kind", "workspaceRevisionId", "checks"],
  "additionalProperties": false,
  "properties": {
    "schemaVersion": { "const": 1 },
    "kind": { "const": "verification" },
    "workspaceRevisionId": {
      "type": "string",
      "pattern": "^rev-",
      "description": "The workspace revision this artifact verifies."
    },
    "recordedAt": { "type": "string", "format": "date-time" },
    "producedBy": {
      "type": "object",
      "required": ["attachmentId"],
      "additionalProperties": false,
      "properties": {
        "attachmentId": { "type": "string", "minLength": 1 },
        "environmentId": { "type": "string", "minLength": 1 }
      }
    },
    "checks": {
      "type": "array",
      "minItems": 1,
      "items": {
        "type": "object",
        "required": ["name", "passed"],
        "additionalProperties": false,
        "properties": {
          "name": { "type": "string", "minLength": 1 },
          "passed": { "type": "boolean" }
        }
      }
    }
  }
}
